<?xml version="1.0" encoding="UTF-8"?>
<Batallas xmlns:xsi="http://www.w3.org/2001/XMLSchema-instance"
xsi:noNamespaceSchemaLocation="batallas.xsd">
    <Batalla Enemigo_ID="32" Jugador_ID="3">
      <!--El orden debe ser num_Turnos primero y despuÃ©s num_Ayudantes-->
      <num_Ayudantes>0</num_Ayudantes>
      <num_Turnos>10</num_Turnos>
      
   </Batalla>
   <!--Falta el atributo Jugador_ID cuando es required-->
   <Batalla Enemigo_ID="2">
      <num_Turnos>9</num_Turnos>
      <num_Ayudantes>2</num_Ayudantes>
   </Batalla>
   <Batalla Enemigo_ID="10" Jugador_ID="5">
      <!--num_Turnos es de tipo integer y tiene un string-->
      <num_Turnos>tres</num_Turnos>
      <num_Ayudantes>0</num_Ayudantes>
   </Batalla>
   <!--Falta el atributo Enemigo_ID cuando es required-->
   <!--El atributo Jugador_ID es de tipo positiveInteger, por lo que no puede ser 0-->
   <!--AdemÃ¡s, Jugador_ID tiene una restricciÃ³n por la que no puede ser menor de 1-->
   <Batalla Jugador_ID="0">
      <num_Turnos>9</num_Turnos>
      <num_Ayudantes>0</num_Ayudantes>
   </Batalla>
</Batallas>